"No.","Time","Source","Destination","Protocol","Length","Source Port","Destination Port","Expert Info","Info"
"1","0.000000","192.168.1.151","54.149.94.178","TLSv1.2","124","51218","443","","Application Data"
"2","0.001261","192.168.1.151","54.149.94.178","TLSv1.2","124","51219","443","","Application Data"
"3","0.011076","192.168.1.151","104.244.42.193","TCP","54","51667","443","","51667  >  443 [ACK] Seq=1 Ack=1 Win=2048 Len=0"
"4","0.049109","104.244.42.193","192.168.1.151","TCP","66","443","51667","Warning","[TCP ACKed unseen segment] 443  >  51667 [ACK] Seq=1 Ack=2 Win=296 Len=0 TSval=3734050338 TSecr=1225843016"
"5","0.085047","54.149.94.178","192.168.1.151","TCP","66","443","51218","","443  >  51218 [ACK] Seq=1 Ack=59 Win=10 Len=0 TSval=841716682 TSecr=1225978277"
"6","0.085049","54.149.94.178","192.168.1.151","TCP","66","443","51219","","443  >  51219 [ACK] Seq=1 Ack=59 Win=10 Len=0 TSval=1316916866 TSecr=1225978278"
"7","0.227351","192.168.1.1","255.255.255.255","UDP","215","48952","7437","","48952  >  7437 Len=173"
"8","0.755385","192.168.1.151","52.23.32.39","TLSv1.2","129","51284","443","","Application Data"
"9","0.774134","192.168.1.151","172.217.12.14","UDP","75","54854","443","","54854  >  443 Len=33"
"10","0.804934","172.217.12.14","192.168.1.151","UDP","67","443","54854","","443  >  54854 Len=25"
"11","0.811915","52.23.32.39","192.168.1.151","TLSv1.2","125","443","51284","","Application Data"
"12","0.811978","192.168.1.151","52.23.32.39","TCP","66","51284","443","","51284  >  443 [ACK] Seq=64 Ack=60 Win=2047 Len=0 TSval=1225979084 TSecr=2580739294"
"13","0.936947","192.168.1.151","54.149.94.178","TLSv1.2","122","51218","443","","Application Data"
"14","0.982162","54.149.94.178","192.168.1.151","TCP","66","443","51218","","443  >  51218 [ACK] Seq=1 Ack=115 Win=10 Len=0 TSval=841716906 TSecr=1225979207"
"15","0.982165","54.149.94.178","192.168.1.151","TLSv1.2","122","443","51218","","Application Data"
"16","0.982229","192.168.1.151","54.149.94.178","TCP","66","51218","443","","51218  >  443 [ACK] Seq=115 Ack=57 Win=2047 Len=0 TSval=1225979251 TSecr=841716906"
"17","2.107128","192.168.1.151","54.149.94.178","TLSv1.2","122","51219","443","","Application Data"
"18","2.156465","54.149.94.178","192.168.1.151","TCP","66","443","51219","","443  >  51219 [ACK] Seq=1 Ack=115 Win=10 Len=0 TSval=1316917383 TSecr=1225980372"
"19","2.156468","54.149.94.178","192.168.1.151","TLSv1.2","122","443","51219","","Application Data"
"20","2.156523","192.168.1.151","54.149.94.178","TCP","66","51219","443","","51219  >  443 [ACK] Seq=115 Ack=57 Win=2047 Len=0 TSval=1225980420 TSecr=1316917383"
"21","2.707611","192.168.1.151","192.241.241.147","TCP","54","51389","443","","51389  >  443 [ACK] Seq=1 Ack=1 Win=2048 Len=0"
"22","2.762980","192.241.241.147","192.168.1.151","TCP","66","443","51389","Warning","[TCP ACKed unseen segment] 443  >  51389 [ACK] Seq=1 Ack=2 Win=501 Len=0 TSval=3133806279 TSecr=1225935842"
"23","2.893219","34.206.167.66","192.168.1.151","TLSv1.2","133","443","51229","","Application Data"
"24","2.893275","192.168.1.151","34.206.167.66","TCP","66","51229","443","","51229  >  443 [ACK] Seq=1 Ack=68 Win=2046 Len=0 TSval=1225981153 TSecr=2310365236"
"25","3.299283","192.168.1.1","255.255.255.255","UDP","215","48952","7437","","48952  >  7437 Len=173"
"26","3.665474","192.168.1.151","192.168.1.205","TCP","78","52803","6690","Chat","52803  >  6690 [SYN] Seq=0 Win=65535 Len=0 MSS=1460 WS=64 TSval=1225981924 TSecr=0 SACK_PERM=1"
"27","3.672066","192.168.1.205","192.168.1.151","TCP","74","6690","52803","Chat","6690  >  52803 [SYN, ACK] Seq=0 Ack=1 Win=28960 Len=0 MSS=1460 SACK_PERM=1 TSval=730073052 TSecr=1225981924 WS=128"
"28","3.672115","192.168.1.151","192.168.1.205","TCP","66","52803","6690","","52803  >  6690 [ACK] Seq=1 Ack=1 Win=131712 Len=0 TSval=1225981930 TSecr=730073052"
"29","3.672235","192.168.1.151","192.168.1.205","TLSv1.2","202","52803","6690","Warning","Ignored Unknown Record"
"30","3.677371","192.168.1.205","192.168.1.151","TCP","66","6690","52803","","6690  >  52803 [ACK] Seq=1 Ack=137 Win=30080 Len=0 TSval=730073056 TSecr=1225981930"
"31","3.677373","192.168.1.205","192.168.1.151","TLSv1.2","436","6690","52803","Warning","Ignored Unknown Record"
"32","3.677413","192.168.1.151","192.168.1.205","TCP","66","52803","6690","","52803  >  6690 [ACK] Seq=137 Ack=371 Win=131392 Len=0 TSval=1225981935 TSecr=730073057"
"33","3.683921","192.168.1.151","192.168.1.205","TLSv1.2","230","52803","6690","","Client Hello"
"34","3.686958","192.168.1.205","192.168.1.151","TLSv1.2","951","6690","52803","","Server Hello, Certificate, Server Hello Done"
"35","3.686994","192.168.1.151","192.168.1.205","TCP","66","52803","6690","","52803  >  6690 [ACK] Seq=301 Ack=1256 Win=130496 Len=0 TSval=1225981944 TSecr=730073067"
"36","3.687210","192.168.1.151","192.168.1.205","TLSv1.2","384","52803","6690","","Client Key Exchange, Change Cipher Spec, Encrypted Handshake Message"
"37","3.694728","192.168.1.205","192.168.1.151","TLSv1.2","292","6690","52803","","New Session Ticket, Change Cipher Spec, Encrypted Handshake Message"
"38","3.694759","192.168.1.151","192.168.1.205","TCP","66","52803","6690","","52803  >  6690 [ACK] Seq=619 Ack=1482 Win=130816 Len=0 TSval=1225981951 TSecr=730073075"
"39","3.694909","192.168.1.151","192.168.1.205","TLSv1.2","99","52803","6690","","Application Data"
"40","3.694913","192.168.1.151","192.168.1.205","TLSv1.2","96","52803","6690","","Application Data"
"41","3.694917","192.168.1.151","192.168.1.205","TLSv1.2","96","52803","6690","","Application Data"
"42","3.694920","192.168.1.151","192.168.1.205","TLSv1.2","97","52803","6690","","Application Data"
"43","3.694923","192.168.1.151","192.168.1.205","TLSv1.2","96","52803","6690","","Application Data"
"44","3.694946","192.168.1.151","192.168.1.205","TLSv1.2","96","52803","6690","","Application Data"
"45","3.694947","192.168.1.151","192.168.1.205","TLSv1.2","97","52803","6690","","Application Data"
"46","3.694947","192.168.1.151","192.168.1.205","TLSv1.2","101","52803","6690","","Application Data"
"47","3.694947","192.168.1.151","192.168.1.205","TLSv1.2","96","52803","6690","","Application Data"
"48","3.694947","192.168.1.151","192.168.1.205","TLSv1.2","97","52803","6690","","Application Data"
"49","3.694948","192.168.1.151","192.168.1.205","TLSv1.2","110","52803","6690","","Application Data"
"50","3.694957","192.168.1.151","192.168.1.205","TLSv1.2","96","52803","6690","","Application Data"
"51","3.694957","192.168.1.151","192.168.1.205","TLSv1.2","97","52803","6690","","Application Data"
"52","3.694957","192.168.1.151","192.168.1.205","TLSv1.2","100","52803","6690","","Application Data"
"53","3.694962","192.168.1.151","192.168.1.205","TLSv1.2","96","52803","6690","","Application Data"
"54","3.694965","192.168.1.151","192.168.1.205","TLSv1.2","96","52803","6690","","Application Data"
"55","3.694968","192.168.1.151","192.168.1.205","TLSv1.2","97","52803","6690","","Application Data"
"56","3.694972","192.168.1.151","192.168.1.205","TLSv1.2","103","52803","6690","","Application Data"
"57","3.694998","192.168.1.151","192.168.1.205","TLSv1.2","96","52803","6690","","Application Data"
"58","3.694998","192.168.1.151","192.168.1.205","TLSv1.2","97","52803","6690","","Application Data"
"59","3.694999","192.168.1.151","192.168.1.205","TLSv1.2","98","52803","6690","","Application Data"
"60","3.694999","192.168.1.151","192.168.1.205","TLSv1.2","96","52803","6690","","Application Data"
"61","3.694999","192.168.1.151","192.168.1.205","TLSv1.2","97","52803","6690","","Application Data"
"62","3.694999","192.168.1.151","192.168.1.205","TLSv1.2","99","52803","6690","","Application Data"
"63","3.695016","192.168.1.151","192.168.1.205","TLSv1.2","96","52803","6690","","Application Data"
"64","3.695016","192.168.1.151","192.168.1.205","TLSv1.2","97","52803","6690","","Application Data"
"65","3.695017","192.168.1.151","192.168.1.205","TLSv1.2","101","52803","6690","","Application Data"
"66","3.695017","192.168.1.151","192.168.1.205","TLSv1.2","96","52803","6690","","Application Data"
"67","3.695017","192.168.1.151","192.168.1.205","TLSv1.2","97","52803","6690","","Application Data"
"68","3.695017","192.168.1.151","192.168.1.205","TLSv1.2","102","52803","6690","","Application Data"
"69","3.695026","192.168.1.151","192.168.1.205","TLSv1.2","96","52803","6690","","Application Data"
"70","3.695026","192.168.1.151","192.168.1.205","TLSv1.2","96","52803","6690","","Application Data"
"71","3.695039","192.168.1.151","192.168.1.205","TLSv1.2","97","52803","6690","","Application Data"
"72","3.695039","192.168.1.151","192.168.1.205","TLSv1.2","100","52803","6690","","Application Data"
"73","3.695039","192.168.1.151","192.168.1.205","TLSv1.2","96","52803","6690","","Application Data"
"74","3.695039","192.168.1.151","192.168.1.205","TLSv1.2","96","52803","6690","","Application Data"
"75","3.695046","192.168.1.151","192.168.1.205","TLSv1.2","97","52803","6690","","Application Data"
"76","3.695046","192.168.1.151","192.168.1.205","TLSv1.2","96","52803","6690","","Application Data"
"77","3.695050","192.168.1.151","192.168.1.205","TLSv1.2","97","52803","6690","","Application Data"
"78","3.695053","192.168.1.151","192.168.1.205","TLSv1.2","100","52803","6690","","Application Data"
"79","3.695056","192.168.1.151","192.168.1.205","TLSv1.2","96","52803","6690","","Application Data"
"80","3.695059","192.168.1.151","192.168.1.205","TLSv1.2","96","52803","6690","","Application Data"
"81","3.695062","192.168.1.151","192.168.1.205","TLSv1.2","96","52803","6690","","Application Data"
"82","3.695077","192.168.1.151","192.168.1.205","TLSv1.2","96","52803","6690","","Application Data"
"83","3.695077","192.168.1.151","192.168.1.205","TLSv1.2","97","52803","6690","","Application Data"
"84","3.695077","192.168.1.151","192.168.1.205","TLSv1.2","99","52803","6690","","Application Data"
"85","3.695078","192.168.1.151","192.168.1.205","TLSv1.2","96","52803","6690","","Application Data"
"86","3.695085","192.168.1.151","192.168.1.205","TLSv1.2","96","52803","6690","","Application Data"
"87","3.695085","192.168.1.151","192.168.1.205","TLSv1.2","96","52803","6690","","Application Data"
"88","3.695096","192.168.1.151","192.168.1.205","TLSv1.2","96","52803","6690","","Application Data"
"89","3.695096","192.168.1.151","192.168.1.205","TLSv1.2","97","52803","6690","","Application Data"
"90","3.695096","192.168.1.151","192.168.1.205","TLSv1.2","100","52803","6690","","Application Data"
"91","3.695107","192.168.1.151","192.168.1.205","TLSv1.2","96","52803","6690","","Application Data"
"92","3.695107","192.168.1.151","192.168.1.205","TLSv1.2","96","52803","6690","","Application Data"
"93","3.695107","192.168.1.151","192.168.1.205","TLSv1.2","96","52803","6690","","Application Data"
"94","3.695108","192.168.1.151","192.168.1.205","TLSv1.2","96","52803","6690","","Application Data"
"95","3.695114","192.168.1.151","192.168.1.205","TLSv1.2","96","52803","6690","","Application Data"
"96","3.695114","192.168.1.151","192.168.1.205","TLSv1.2","96","52803","6690","","Application Data"
"97","3.695118","192.168.1.151","192.168.1.205","TLSv1.2","97","52803","6690","","Application Data"
"98","3.695120","192.168.1.151","192.168.1.205","TLSv1.2","103","52803","6690","","Application Data"
"99","3.695124","192.168.1.151","192.168.1.205","TLSv1.2","96","52803","6690","","Application Data"
"100","3.695137","192.168.1.151","192.168.1.205","TLSv1.2","96","52803","6690","","Application Data"
"101","3.695137","192.168.1.151","192.168.1.205","TLSv1.2","96","52803","6690","","Application Data"
"102","3.695137","192.168.1.151","192.168.1.205","TLSv1.2","96","52803","6690","","Application Data"
"103","3.695144","192.168.1.151","192.168.1.205","TLSv1.2","97","52803","6690","","Application Data"
"104","3.695144","192.168.1.151","192.168.1.205","TLSv1.2","102","52803","6690","","Application Data"
"105","3.695147","192.168.1.151","192.168.1.205","TLSv1.2","96","52803","6690","","Application Data"
"106","3.695157","192.168.1.151","192.168.1.205","TLSv1.2","97","52803","6690","","Application Data"
"107","3.695157","192.168.1.151","192.168.1.205","TLSv1.2","127","52803","6690","","Application Data"
"108","3.695166","192.168.1.151","192.168.1.205","TLSv1.2","96","52803","6690","","Application Data"
"109","3.700180","192.168.1.205","192.168.1.151","TCP","66","6690","52803","","6690  >  52803 [ACK] Seq=1482 Ack=1160 Win=32256 Len=0 TSval=730073080 TSecr=1225981951"
"110","3.700181","192.168.1.205","192.168.1.151","TCP","66","6690","52803","","6690  >  52803 [ACK] Seq=1482 Ack=1227 Win=32256 Len=0 TSval=730073080 TSecr=1225981951"
"111","3.701371","192.168.1.205","192.168.1.151","TCP","66","6690","52803","","6690  >  52803 [ACK] Seq=1482 Ack=1290 Win=32256 Len=0 TSval=730073080 TSecr=1225981951"
"112","3.701372","192.168.1.205","192.168.1.151","TCP","66","6690","52803","","6690  >  52803 [ACK] Seq=1482 Ack=1384 Win=32256 Len=0 TSval=730073080 TSecr=1225981951"
"113","3.701373","192.168.1.205","192.168.1.151","TCP","66","6690","52803","","6690  >  52803 [ACK] Seq=1482 Ack=1445 Win=32256 Len=0 TSval=730073080 TSecr=1225981951"
"114","3.701374","192.168.1.205","192.168.1.151","TCP","66","6690","52803","","6690  >  52803 [ACK] Seq=1482 Ack=1510 Win=32256 Len=0 TSval=730073080 TSecr=1225981951"
"115","3.701374","192.168.1.205","192.168.1.151","TCP","66","6690","52803","","6690  >  52803 [ACK] Seq=1482 Ack=1607 Win=32256 Len=0 TSval=730073080 TSecr=1225981951"
"116","3.706282","192.168.1.205","192.168.1.151","TCP","66","6690","52803","","6690  >  52803 [ACK] Seq=1482 Ack=1702 Win=32256 Len=0 TSval=730073081 TSecr=1225981951"
"117","3.706283","192.168.1.205","192.168.1.151","TCP","66","6690","52803","","6690  >  52803 [ACK] Seq=1482 Ack=1762 Win=32256 Len=0 TSval=730073081 TSecr=1225981951"
"118","3.707613","192.168.1.205","192.168.1.151","TCP","66","6690","52803","","6690  >  52803 [ACK] Seq=1482 Ack=1854 Win=32256 Len=0 TSval=730073081 TSecr=1225981951"
"119","3.707615","192.168.1.205","192.168.1.151","TCP","66","6690","52803","","6690  >  52803 [ACK] Seq=1482 Ack=1918 Win=32256 Len=0 TSval=730073081 TSecr=1225981951"
"120","3.707616","192.168.1.205","192.168.1.151","TCP","66","6690","52803","","6690  >  52803 [ACK] Seq=1482 Ack=2008 Win=32256 Len=0 TSval=730073082 TSecr=1225981951"
"121","3.707617","192.168.1.205","192.168.1.151","TCP","66","6690","52803","","6690  >  52803 [ACK] Seq=1482 Ack=2072 Win=32256 Len=0 TSval=730073082 TSecr=1225981951"
"122","3.707618","192.168.1.205","192.168.1.151","TCP","66","6690","52803","","6690  >  52803 [ACK] Seq=1482 Ack=2162 Win=32256 Len=0 TSval=730073082 TSecr=1225981951"
"123","3.707619","192.168.1.205","192.168.1.151","TCP","66","6690","52803","","6690  >  52803 [ACK] Seq=1482 Ack=2223 Win=32256 Len=0 TSval=730073082 TSecr=1225981951"
"124","3.707619","192.168.1.205","192.168.1.151","TCP","66","6690","52803","","6690  >  52803 [ACK] Seq=1482 Ack=2287 Win=32256 Len=0 TSval=730073082 TSecr=1225981951"
"125","3.707620","192.168.1.205","192.168.1.151","TCP","66","6690","52803","","6690  >  52803 [ACK] Seq=1482 Ack=2347 Win=32256 Len=0 TSval=730073082 TSecr=1225981951"
"126","3.707620","192.168.1.205","192.168.1.151","TCP","66","6690","52803","","6690  >  52803 [ACK] Seq=1482 Ack=2407 Win=32256 Len=0 TSval=730073082 TSecr=1225981951"
"127","3.707621","192.168.1.205","192.168.1.151","TCP","74","6690","52803","","6690  >  52803 [ACK] Seq=1482 Ack=2468 Win=32256 Len=0 TSval=730073082 TSecr=1225981951"
"128","3.707621","192.168.1.205","192.168.1.151","TCP","74","6690","52803","","6690  >  52803 [ACK] Seq=1482 Ack=2535 Win=32256 Len=0 TSval=730073082 TSecr=1225981951"
"129","3.707622","192.168.1.205","192.168.1.151","TCP","74","6690","52803","","6690  >  52803 [ACK] Seq=1482 Ack=2595 Win=32256 Len=0 TSval=730073082 TSecr=1225981951"
"130","3.707622","192.168.1.205","192.168.1.151","TCP","74","6690","52803","","6690  >  52803 [ACK] Seq=1482 Ack=2656 Win=32256 Len=0 TSval=730073082 TSecr=1225981951"
"131","3.707623","192.168.1.205","192.168.1.151","TCP","74","6690","52803","","6690  >  52803 [ACK] Seq=1482 Ack=2753 Win=32256 Len=0 TSval=730073082 TSecr=1225981951"
"132","3.707623","192.168.1.205","192.168.1.151","TCP","66","6690","52803","","6690  >  52803 [ACK] Seq=1482 Ack=2844 Win=32256 Len=0 TSval=730073082 TSecr=1225981951"
"133","3.708204","192.168.1.205","192.168.1.151","TLSv1.2","96","6690","52803","","Application Data"
"134","3.708206","192.168.1.205","192.168.1.151","TLSv1.2","96","6690","52803","","Application Data"
"135","3.708233","192.168.1.151","192.168.1.205","TCP","66","52803","6690","","52803  >  6690 [ACK] Seq=2844 Ack=1512 Win=131008 Len=0 TSval=1225981962 TSecr=730073088"
"136","3.708253","192.168.1.151","192.168.1.205","TCP","66","52803","6690","","52803  >  6690 [ACK] Seq=2844 Ack=1542 Win=131008 Len=0 TSval=1225981962 TSecr=730073088"
"137","3.708323","192.168.1.205","192.168.1.151","TLSv1.2","479","6690","52803","","Application Data, Application Data, Application Data, Application Data, Application Data, Application Data, Application Data, Application Data, Application Data, Application Data, Application Data, Application Data, Application Data"
"138","3.708324","192.168.1.205","192.168.1.151","TLSv1.2","284","6690","52803","","Application Data, Application Data, Application Data, Application Data, Application Data, Application Data, Application Data"
"139","3.708335","192.168.1.151","192.168.1.205","TCP","66","52803","6690","","52803  >  6690 [ACK] Seq=2844 Ack=1955 Win=130624 Len=0 TSval=1225981962 TSecr=730073088"
"140","3.708341","192.168.1.151","192.168.1.205","TCP","66","52803","6690","","52803  >  6690 [ACK] Seq=2844 Ack=2173 Win=130432 Len=0 TSval=1225981962 TSecr=730073089"
"141","3.708600","192.168.1.205","192.168.1.151","TLSv1.2","443","6690","52803","","Application Data, Application Data, Application Data, Application Data, Application Data, Application Data, Application Data, Application Data, Application Data, Application Data, Application Data, Application Data"
"142","3.708604","192.168.1.205","192.168.1.151","TLSv1.2","473","6690","52803","","Application Data, Application Data, Application Data, Application Data, Application Data, Application Data, Application Data, Application Data, Application Data, Application Data, Application Data, Application Data, Application Data"
"143","3.708651","192.168.1.151","192.168.1.205","TCP","66","52803","6690","","52803  >  6690 [ACK] Seq=2844 Ack=2550 Win=130688 Len=0 TSval=1225981963 TSecr=730073089"
"144","3.708662","192.168.1.151","192.168.1.205","TCP","66","52803","6690","","52803  >  6690 [ACK] Seq=2844 Ack=2957 Win=130240 Len=0 TSval=1225981963 TSecr=730073089"
"145","3.708756","192.168.1.205","192.168.1.151","TLSv1.2","972","6690","52803","","Application Data, Application Data, Application Data, Application Data, Application Data, Application Data, Application Data, Application Data, Application Data, Application Data, Application Data, Application Data, Application Data, Application Data, Application Data, Application Data, Application Data, Application Data, Application Data, Application Data, Application Data, Application Data, Application Data, Application Data, Application Data, Application Data, Application Data, Application Data, Application Data"
"146","3.708758","192.168.1.205","192.168.1.151","TLSv1.2","525","6690","52803","","Application Data, Application Data, Application Data, Application Data, Application Data, Application Data, Application Data, Application Data, Application Data, Application Data, Application Data, Application Data, Application Data, Application Data, Application Data"
"147","3.708780","192.168.1.151","192.168.1.205","TCP","66","52803","6690","","52803  >  6690 [ACK] Seq=2844 Ack=3863 Win=130112 Len=0 TSval=1225981963 TSecr=730073089"
"148","3.708786","192.168.1.151","192.168.1.205","TCP","66","52803","6690","","52803  >  6690 [ACK] Seq=2844 Ack=4322 Win=129664 Len=0 TSval=1225981963 TSecr=730073089"
"149","3.708860","192.168.1.205","192.168.1.151","TLSv1.2","997","6690","52803","","Application Data, Application Data, Application Data, Application Data, Application Data, Application Data, Application Data, Application Data, Application Data, Application Data, Application Data, Application Data, Application Data, Application Data, Application Data, Application Data, Application Data, Application Data, Application Data, Application Data, Application Data, Application Data, Application Data, Application Data, Application Data, Application Data, Application Data, Application Data, Application Data"
"150","3.708861","192.168.1.205","192.168.1.151","TLSv1.2","435","6690","52803","","Application Data, Application Data, Application Data, Application Data, Application Data, Application Data, Application Data, Application Data, Application Data, Application Data, Application Data, Application Data"
"151","3.708882","192.168.1.151","192.168.1.205","TCP","66","52803","6690","","52803  >  6690 [ACK] Seq=2844 Ack=5253 Win=130048 Len=0 TSval=1225981963 TSecr=730073089"
"152","3.708883","192.168.1.151","192.168.1.205","TCP","66","52803","6690","","52803  >  6690 [ACK] Seq=2844 Ack=5622 Win=129728 Len=0 TSval=1225981963 TSecr=730073089"
"153","3.711896","192.168.1.205","192.168.1.151","TLSv1.2","1514","6690","52803","","Application Data, Application Data, Application Data, Application Data, Application Data, Application Data, Application Data, Application Data, Application Data, Application Data, Application Data, Application Data, Application Data, Application Data, Application Data, Application Data, Application Data, Application Data, Application Data, Application Data, Application Data, Application Data, Application Data, Application Data, Application Data, Application Data, Application Data, Application Data, Application Data, Application Data, Application Data, Application Data, Application Data, Application Data, Application Data, Application Data, Application Data, Application Data, Application Data, Application Data, Application Data, Application Data, Application Data, Application Data, Application Data, Application Data"
"154","3.712045","192.168.1.205","192.168.1.151","TLSv1.2","1164","6690","52803","","Application Data, Application Data, Application Data, Application Data, Application Data, Application Data, Application Data, Application Data, Application Data, Application Data, Application Data, Application Data, Application Data, Application Data, Application Data, Application Data, Application Data, Application Data, Application Data, Application Data, Application Data, Application Data, Application Data, Application Data, Application Data, Application Data, Application Data, Application Data, Application Data, Application Data, Application Data, Application Data, Application Data, Application Data, Application Data"
"155","3.712069","192.168.1.151","192.168.1.205","TCP","66","52803","6690","","52803  >  6690 [ACK] Seq=2844 Ack=8168 Win=129920 Len=0 TSval=1225981966 TSecr=730073092"
"156","3.713727","192.168.1.151","192.168.1.205","TCP","66","52803","6690","Chat","52803  >  6690 [FIN, ACK] Seq=2844 Ack=8168 Win=129920 Len=0 TSval=1225981967 TSecr=730073092"
"157","3.721708","192.168.1.205","192.168.1.151","TCP","66","6690","52803","Chat","6690  >  52803 [FIN, ACK] Seq=8168 Ack=2845 Win=32256 Len=0 TSval=730073102 TSecr=1225981967"
"158","3.721755","192.168.1.151","192.168.1.205","TCP","66","52803","6690","","52803  >  6690 [ACK] Seq=2845 Ack=8169 Win=129920 Len=0 TSval=1225981975 TSecr=730073102"
"159","4.088774","192.168.1.151","172.217.2.14","UDP","75","55499","443","","55499  >  443 Len=33"
"160","4.098720","172.217.2.14","192.168.1.151","UDP","68","443","55499","","443  >  55499 Len=26"
"161","4.633238","162.125.8.13","192.168.1.151","TLSv1.2","112","443","52585","","Application Data"
"162","4.633296","192.168.1.151","162.125.8.13","TCP","66","52585","443","","52585  >  443 [ACK] Seq=1 Ack=47 Win=2047 Len=0 TSval=1225982881 TSecr=655575906"
"163","4.633368","192.168.1.151","162.125.8.13","TLSv1.2","112","52585","443","","Application Data"
"164","4.633412","192.168.1.151","162.125.8.13","TLSv1.2","97","52585","443","Chat","Encrypted Alert"
"165","4.660211","162.125.8.13","192.168.1.151","TCP","66","443","52585","","443  >  52585 [ACK] Seq=47 Ack=47 Win=67 Len=0 TSval=655575987 TSecr=1225982881"
"166","4.660216","162.125.8.13","192.168.1.151","TLSv1.2","97","443","52585","","Encrypted Alert"
"167","4.660217","162.125.8.13","192.168.1.151","TCP","66","443","52585","Chat","443  >  52585 [FIN, ACK] Seq=78 Ack=79 Win=67 Len=0 TSval=655575987 TSecr=1225982881"
"168","4.660321","192.168.1.151","162.125.8.13","TCP","54","52585","443","Warning","52585  >  443 [RST] Seq=79 Win=0 Len=0"
"169","4.660321","192.168.1.151","162.125.8.13","TCP","54","52585","443","Warning","52585  >  443 [RST] Seq=79 Win=0 Len=0"
"170","4.886896","192.168.1.151","64.233.191.189","UDP","75","63148","443","","63148  >  443 Len=33"
"171","4.900614","Tp-LinkT_c6:1c:2b","Apple_2f:d1:7b","ARP","42","","","","Who has 192.168.1.151? Tell 192.168.1.1"
"172","4.900654","Apple_2f:d1:7b","Tp-LinkT_c6:1c:2b","ARP","42","","","","192.168.1.151 is at a4:83:e7:2f:d1:7b"
"173","4.908529","64.233.191.189","192.168.1.151","UDP","67","443","63148","","443  >  63148 Len=25"
"174","5.346791","192.168.1.205","224.0.0.251","MDNS","146","5353","5353","","Standard query 0x0000 A Living-Room.local, ""QM"" question SRV C869CD515D68@Living Room._raop._tcp.local, ""QM"" question SRV Living Room._airplay._tcp.local, ""QM"" question"
"175","5.449159","192.168.1.122","224.0.0.251","MDNS","274","5353","5353","","Standard query response 0x0000 A, cache flush 192.168.1.122 SRV, cache flush 0 0 7000 Living-Room.local SRV, cache flush 0 0 7000 Living-Room.local AAAA, cache flush fe80::866:6fa:d134:f151 NSEC, cache flush Living-Room.local NSEC, cache flush Living Room._airplay._tcp.local NSEC, cache flush C869CD515D68@Living Room._raop._tcp.local"
"176","5.454444","fe80::866:6fa:d134:f151","ff02::fb","MDNS","294","5353","5353","","Standard query response 0x0000 A, cache flush 192.168.1.122 SRV, cache flush 0 0 7000 Living-Room.local SRV, cache flush 0 0 7000 Living-Room.local AAAA, cache flush fe80::866:6fa:d134:f151 NSEC, cache flush Living-Room.local NSEC, cache flush Living Room._airplay._tcp.local NSEC, cache flush C869CD515D68@Living Room._raop._tcp.local"
"177","5.963256","34.206.167.66","192.168.1.151","TLSv1.2","133","443","51229","","Application Data"
"178","5.963314","192.168.1.151","34.206.167.66","TCP","66","51229","443","","51229  >  443 [ACK] Seq=1 Ack=135 Win=2046 Len=0 TSval=1225984203 TSecr=2310365987"
"179","6.100768","104.248.5.185","192.168.1.151","TLSv1.2","90","443","51395","","Application Data"
"180","6.100827","192.168.1.151","104.248.5.185","TCP","66","51395","443","","51395  >  443 [ACK] Seq=1 Ack=25 Win=2047 Len=0 TSval=1225984340 TSecr=2388913589"
"181","6.100906","192.168.1.151","104.248.5.185","TLSv1.2","94","51395","443","","Application Data"
"182","6.153938","104.248.5.185","192.168.1.151","TCP","66","443","51395","","443  >  51395 [ACK] Seq=25 Ack=29 Win=33 Len=0 TSval=2388913642 TSecr=1225984340"
"183","6.283824","192.168.1.1","192.168.1.151","NBNS","92","34609","137","","Name query NBSTAT *<00><00><00><00><00><00><00><00><00><00><00><00><00><00><00>"
"184","6.283959","192.168.1.151","192.168.1.1","NBNS","163","137","34609","","Name query response NBSTAT"
"185","6.291636","192.168.1.1","192.168.1.151","NBNS","92","42959","137","","Name query NBSTAT *<00><00><00><00><00><00><00><00><00><00><00><00><00><00><00>"
"186","6.291754","192.168.1.151","192.168.1.1","NBNS","163","137","42959","","Name query response NBSTAT"
"187","6.293429","192.168.1.1","192.168.1.151","ICMP","191","137","42959","","Destination unreachable (Port unreachable)"
"188","6.371111","192.168.1.1","255.255.255.255","UDP","215","48952","7437","","48952  >  7437 Len=173"
"189","6.784122","35.170.229.85","192.168.1.151","TLSv1.2","597","443","52762","","Application Data"
"190","6.784126","35.170.229.85","192.168.1.151","TLSv1.2","97","443","52762","Chat","Encrypted Alert"
"191","6.784187","192.168.1.151","35.170.229.85","TCP","66","52762","443","","52762  >  443 [ACK] Seq=1 Ack=532 Win=2039 Len=0 TSval=1225985020 TSecr=2319051801"
"192","6.784216","192.168.1.151","35.170.229.85","TCP","66","52762","443","","52762  >  443 [ACK] Seq=1 Ack=564 Win=2039 Len=0 TSval=1225985020 TSecr=2319051801"
"193","6.784289","192.168.1.151","35.170.229.85","TLSv1.2","97","52762","443","","Encrypted Alert"
"194","6.784824","192.168.1.151","35.170.229.85","TCP","66","52762","443","Chat","52762  >  443 [FIN, ACK] Seq=32 Ack=564 Win=2048 Len=0 TSval=1225985020 TSecr=2319051801"
"195","6.786306","192.168.1.151","18.206.134.103","TCP","78","52807","443","Chat","52807  >  443 [SYN] Seq=0 Win=65535 Len=0 MSS=1460 WS=64 TSval=1225985021 TSecr=0 SACK_PERM=1"
"196","6.837336","192.168.1.151","192.168.1.1","DNS","83","48770","53","","Standard query 0x3db2 A pollserver.lastpass.com"
"197","6.842429","35.170.229.85","192.168.1.151","TCP","54","443","52762","Warning","443  >  52762 [RST] Seq=564 Win=0 Len=0"
"198","6.843900","35.170.229.85","192.168.1.151","TCP","54","443","52762","Warning","443  >  52762 [RST] Seq=564 Win=0 Len=0"
"199","6.843902","18.206.134.103","192.168.1.151","TCP","74","443","52807","Chat","443  >  52807 [SYN, ACK] Seq=0 Ack=1 Win=26847 Len=0 MSS=1452 SACK_PERM=1 TSval=2319051898 TSecr=1225985021 WS=256"
"200","6.843967","192.168.1.151","18.206.134.103","TCP","66","52807","443","","52807  >  443 [ACK] Seq=1 Ack=1 Win=132480 Len=0 TSval=1225985078 TSecr=2319051898"
"201","6.844237","192.168.1.151","18.206.134.103","TLSv1.2","294","52807","443","","Client Hello"
"202","6.864636","192.168.1.1","192.168.1.151","DNS","174","53","48770","","Standard query response 0x3db2 A pollserver.lastpass.com CNAME lastpass.com.edgekey.net CNAME e10856.b.akamaiedge.net A 23.4.102.158"
"203","6.864876","192.168.1.151","23.4.102.158","TCP","78","52809","443","Chat","52809  >  443 [SYN] Seq=0 Win=65535 Len=0 MSS=1460 WS=64 TSval=1225985098 TSecr=0 SACK_PERM=1"
"204","6.888071","23.4.102.158","192.168.1.151","TCP","74","443","52809","Chat","443  >  52809 [SYN, ACK] Seq=0 Ack=1 Win=28960 Len=0 MSS=1452 SACK_PERM=1 TSval=276594859 TSecr=1225985098 WS=128"
"205","6.888133","192.168.1.151","23.4.102.158","TCP","66","52809","443","","52809  >  443 [ACK] Seq=1 Ack=1 Win=132480 Len=0 TSval=1225985121 TSecr=276594859"
"206","6.888291","192.168.1.151","23.4.102.158","TLSv1.3","685","52809","443","","Client Hello"
"207","6.896994","18.206.134.103","192.168.1.151","TLSv1.2","1506","443","52807","","Server Hello"
"208","6.897141","18.206.134.103","192.168.1.151","TCP","1506","443","52807","","443  >  52807 [ACK] Seq=1441 Ack=229 Win=28160 Len=1440 TSval=2319051950 TSecr=1225985078 [TCP segment of a reassembled PDU]"
"209","6.897179","192.168.1.151","18.206.134.103","TCP","66","52807","443","","52807  >  443 [ACK] Seq=229 Ack=2881 Win=129600 Len=0 TSval=1225985129 TSecr=2319051950"
"210","6.897417","18.206.134.103","192.168.1.151","TLSv1.2","1506","443","52807","","Certificate, Server Key Exchange"
"211","6.897419","18.206.134.103","192.168.1.151","TLSv1.2","75","443","52807","","Server Hello Done"
"212","6.897445","192.168.1.151","18.206.134.103","TCP","66","52807","443","","52807  >  443 [ACK] Seq=229 Ack=4330 Win=129600 Len=0 TSval=1225985129 TSecr=2319051950"
"213","6.902345","192.168.1.151","18.206.134.103","TLSv1.2","141","52807","443","","Client Key Exchange"
"214","6.902345","192.168.1.151","18.206.134.103","TLSv1.2","72","52807","443","","Change Cipher Spec"
"215","6.902383","192.168.1.151","18.206.134.103","TLSv1.2","111","52807","443","","Encrypted Handshake Message"
"216","6.916634","23.4.102.158","192.168.1.151","TLSv1.3","330","443","52809","","Server Hello, Change Cipher Spec, Application Data, Application Data"
"217","6.916637","23.4.102.158","192.168.1.151","TCP","66","443","52809","","443  >  52809 [ACK] Seq=1 Ack=620 Win=30208 Len=0 TSval=276594887 TSecr=1225985121"
"218","6.916709","192.168.1.151","23.4.102.158","TCP","66","52809","443","","52809  >  443 [ACK] Seq=620 Ack=265 Win=132160 Len=0 TSval=1225985147 TSecr=276594887"
"219","6.916738","192.168.1.151","23.4.102.158","TCP","66","52809","443","Note","[TCP Dup ACK 218#1] 52809  >  443 [ACK] Seq=620 Ack=265 Win=132160 Len=0 TSval=1225985147 TSecr=276594887"
"220","6.917495","192.168.1.151","23.4.102.158","TLSv1.3","146","52809","443","","Change Cipher Spec, Application Data"
"221","6.917616","192.168.1.151","23.4.102.158","TLSv1.3","158","52809","443","","Application Data"
"222","6.917789","192.168.1.151","23.4.102.158","TLSv1.3","835","52809","443","","Application Data"
"223","6.917810","192.168.1.151","23.4.102.158","TLSv1.3","429","52809","443","","Application Data"
"224","6.939078","23.4.102.158","192.168.1.151","TLSv1.3","353","443","52809","","Application Data"
"225","6.939081","23.4.102.158","192.168.1.151","TLSv1.3","136","443","52809","","Application Data"
"226","6.939082","23.4.102.158","192.168.1.151","TCP","66","443","52809","","443  >  52809 [ACK] Seq=622 Ack=1924 Win=33280 Len=0 TSval=276594911 TSecr=1225985148"
"227","6.939139","192.168.1.151","23.4.102.158","TCP","66","52809","443","","52809  >  443 [ACK] Seq=1924 Ack=552 Win=131904 Len=0 TSval=1225985169 TSecr=276594910"
"228","6.939140","192.168.1.151","23.4.102.158","TCP","66","52809","443","","52809  >  443 [ACK] Seq=1924 Ack=622 Win=131840 Len=0 TSval=1225985169 TSecr=276594911"
"229","6.939246","192.168.1.151","23.4.102.158","TLSv1.3","97","52809","443","","Application Data"
"230","6.946642","23.4.102.158","192.168.1.151","TLSv1.3","101","443","52809","","Application Data"
"231","6.946679","192.168.1.151","23.4.102.158","TCP","66","52809","443","","52809  >  443 [ACK] Seq=1955 Ack=657 Win=131776 Len=0 TSval=1225985176 TSecr=276594918"
"232","6.956978","18.206.134.103","192.168.1.151","TCP","66","443","52807","","443  >  52807 [ACK] Seq=4330 Ack=355 Win=28160 Len=0 TSval=2319052010 TSecr=1225985133"
"233","6.956981","18.206.134.103","192.168.1.151","TLSv1.2","117","443","52807","","Change Cipher Spec, Encrypted Handshake Message"
"234","6.957046","192.168.1.151","18.206.134.103","TCP","66","52807","443","","52807  >  443 [ACK] Seq=355 Ack=4381 Win=131008 Len=0 TSval=1225985186 TSecr=2319052010"
"235","6.957215","192.168.1.151","18.206.134.103","TCP","1506","52807","443","","52807  >  443 [ACK] Seq=355 Ack=4381 Win=131072 Len=1440 TSval=1225985186 TSecr=2319052010 [TCP segment of a reassembled PDU]"
"236","6.957215","192.168.1.151","18.206.134.103","TLSv1.2","363","52807","443","","Application Data"
"237","6.996856","23.4.102.158","192.168.1.151","TCP","1506","443","52809","","443  >  52809 [ACK] Seq=657 Ack=1955 Win=33280 Len=1440 TSval=276594967 TSecr=1225985169 [TCP segment of a reassembled PDU]"
"238","6.996859","23.4.102.158","192.168.1.151","TLSv1.3","113","443","52809","","Application Data"
"239","6.996926","192.168.1.151","23.4.102.158","TCP","66","52809","443","","52809  >  443 [ACK] Seq=1955 Ack=2144 Win=130304 Len=0 TSval=1225985225 TSecr=276594967"
"240","7.002896","192.168.1.151","18.214.242.166","TLSv1.2","288","52151","443","","Application Data"
"241","7.002956","192.168.1.151","18.214.242.166","TLSv1.2","105","52151","443","","Application Data"
"242","7.008166","18.206.134.103","192.168.1.151","TCP","66","443","52807","","443  >  52807 [ACK] Seq=4381 Ack=2092 Win=31488 Len=0 TSval=2319052061 TSecr=1225985186"
"243","7.057773","18.214.242.166","192.168.1.151","TLSv1.2","105","443","52151","","Application Data"
"244","7.057776","18.214.242.166","192.168.1.151","TCP","66","443","52151","","443  >  52151 [ACK] Seq=1 Ack=262 Win=16 Len=0 TSval=894720856 TSecr=1225985230"
"245","7.057841","192.168.1.151","18.214.242.166","TCP","66","52151","443","","52151  >  443 [ACK] Seq=262 Ack=40 Win=2047 Len=0 TSval=1225985283 TSecr=894720856"
"246","7.057841","192.168.1.151","18.214.242.166","TCP","66","52151","443","Note","[TCP Dup ACK 245#1] 52151  >  443 [ACK] Seq=262 Ack=40 Win=2047 Len=0 TSval=1225985283 TSecr=894720856"
"247","7.062193","18.214.242.166","192.168.1.151","TLSv1.2","383","443","52151","","Application Data"
"248","7.062237","192.168.1.151","18.214.242.166","TCP","66","52151","443","","52151  >  443 [ACK] Seq=262 Ack=357 Win=2043 Len=0 TSval=1225985287 TSecr=894720857"
"249","7.064513","192.168.1.151","18.214.242.166","TLSv1.2","289","52151","443","","Application Data"
"250","7.117662","18.214.242.166","192.168.1.151","TLSv1.2","383","443","52151","","Application Data"
"251","7.117720","192.168.1.151","18.214.242.166","TCP","66","52151","443","","52151  >  443 [ACK] Seq=485 Ack=674 Win=2043 Len=0 TSval=1225985341 TSecr=894720871"
"252","7.280706","52.111.245.2","192.168.1.151","TLSv1.2","105","443","51282","","Application Data"
"253","7.280781","192.168.1.151","52.111.245.2","TCP","54","51282","443","","51282  >  443 [ACK] Seq=1 Ack=52 Win=4095 Len=0"
"254","8.932717","34.206.167.66","192.168.1.151","TLSv1.2","133","443","51229","","Application Data"
"255","8.932777","192.168.1.151","34.206.167.66","TCP","66","51229","443","","51229  >  443 [ACK] Seq=1 Ack=202 Win=2046 Len=0 TSval=1225987149 TSecr=2310366737"
"256","9.033283","192.168.1.151","192.168.1.1","DNS","75","8346","53","","Standard query 0x1a59 A docs.google.com"
"257","9.033399","192.168.1.151","192.168.1.1","DNS","75","37859","53","","Standard query 0x8c69 A www.gstatic.com"
"258","9.033501","192.168.1.151","192.168.1.1","DNS","80","7790","53","","Standard query 0xc9df A fonts.googleapis.com"
"259","9.036300","192.168.1.151","172.217.2.14","UDP","651","55499","443","","55499  >  443 Len=609"
"260","9.043980","172.217.2.14","192.168.1.151","UDP","68","443","55499","","443  >  55499 Len=26"
"261","9.044555","192.168.1.1","192.168.1.151","DNS","91","53","8346","","Standard query response 0x1a59 A docs.google.com A 172.217.2.14"
"262","9.044557","192.168.1.1","192.168.1.151","DNS","96","53","7790","","Standard query response 0xc9df A fonts.googleapis.com A 172.217.1.202"
"263","9.044558","192.168.1.1","192.168.1.151","DNS","91","53","37859","","Standard query response 0x8c69 A www.gstatic.com A 172.217.1.195"
"264","9.046051","192.168.1.151","172.217.1.195","UDP","1392","64138","443","","64138  >  443 Len=1350"
"265","9.046219","192.168.1.151","192.168.1.1","DNS","77","31395","53","","Standard query 0x2649 A fonts.gstatic.com"
"266","9.046322","192.168.1.151","192.168.1.1","DNS","75","5668","53","","Standard query 0xf68f A ssl.gstatic.com"
"267","9.056220","192.168.1.1","192.168.1.151","DNS","132","53","31395","","Standard query response 0x2649 A fonts.gstatic.com CNAME gstaticadssl.l.google.com A 172.217.1.195"
"268","9.056222","192.168.1.1","192.168.1.151","DNS","91","53","5668","","Standard query response 0xf68f A ssl.gstatic.com A 172.217.2.3"
"269","9.057643","192.168.1.151","172.217.2.3","UDP","1392","65137","443","","65137  >  443 Len=1350"
"270","9.074956","172.217.2.3","192.168.1.151","UDP","1392","443","65137","","443  >  65137 Len=1350"
"271","9.075228","192.168.1.151","172.217.2.3","UDP","75","65137","443","","65137  >  443 Len=33"
"272","9.075991","172.217.1.195","192.168.1.151","UDP","1392","443","64138","","443  >  64138 Len=1350"
"273","9.076203","192.168.1.151","172.217.1.195","UDP","75","64138","443","","64138  >  443 Len=33"
"274","9.342199","172.217.2.14","192.168.1.151","UDP","975","443","55499","","443  >  55499 Len=933"
"275","9.342202","172.217.2.14","192.168.1.151","UDP","1229","443","55499","","443  >  55499 Len=1187"
"276","9.342473","172.217.2.14","192.168.1.151","UDP","1486","443","55499","","443  >  55499 Len=1444"
"277","9.342666","172.217.2.14","192.168.1.151","UDP","694","443","55499","","443  >  55499 Len=652"
"278","9.342672","172.217.2.14","192.168.1.151","UDP","1486","443","55499","","443  >  55499 Len=1444"
